{
  "allowed_candidate_request_ids": [],
  "allowed_scope": "none",
  "assignment_allowed": false,
  "browser_session_start_allowed": false,
  "decision": "deny",
  "decision_id": "browser-read-only-approval-positive-deny",
  "expires_utc": "2099-01-01T00:00:00Z",
  "operator_attestation": "deny-all-no-browser-assignment",
  "operator_id": "human-operator",
  "rollback_plan": "No browser assignment decision is applied.",
  "runtime_boundary": {
    "account_actions": false,
    "approval_rows_written": 0,
    "browser_sessions_started": 0,
    "credentials_accessed": false,
    "decisions_applied": 0,
    "external_side_effects": false,
    "file_transfer_actions": false,
    "form_submit_actions": false,
    "login_actions": false,
    "mcp_tool_calls": false,
    "model_api_calls": false,
    "payment_actions": false,
    "public_actions": false,
    "report_only": true,
    "security_testing_actions": false,
    "service_requests_assigned": 0,
    "service_requests_mutated": 0,
    "wallet_actions": false,
    "worker_starts": 0
  },
  "schema_version": "agent_company.browser_read_only_signed_approval_guard.v1",
  "signed_utc": "2026-06-17T20:20:00Z",
  "source_adapter_contract_validation_path": "E:\\agent-company-lab\\reports\\browser-worker-adapter-contract-v1-validation-20260618.json",
  "source_assignment_preflight_path": "E:\\agent-company-lab\\reports\\browser-read-only-assignment-preflight-v1-validation-20260617.json",
  "worker_start_allowed": false
}
